<?xml version="1.0" encoding="UTF-8"?>
<!ELEMENT person (firstname?, lastname, children*)>
<!ELEMENT firstname (#PCDATA)>
<!ELEMENT lastname (#PCDATA)>
<!ELEMENT children (person)>
<!ATTLIST person id CDATA #REQUIRED>